{
  "language_name": "REPLACE_ME",
  "iso_code": "REPLACE_ME",
  "status": "planned",
  "research_stage": "not_started",
  "language_family": "REPLACE_ME",
  "countries": [],
  "dialects": [],
  "writing_system": "REPLACE_ME",
  "number_of_speakers": 0,
  "datasets": [],
  "models": [],
  "known_challenges": []
}
